{"records":[{"authority_record_id":"fixture-authority","authority_version":"1","permitted_scopes":[{"action":"read","resource_ids":["complaint-456"],"resource_type":"employee_complaint"}],"principal":"fixture-agent","roles":["hr_investigator"],"valid_from":"2026-09-05T00:00:00Z","valid_to":"2026-09-06T00:00:00Z"}],"schema_version":"2.0","source_id":"deterministic-m7-authority-fixture","source_version":"1"}